<?xml version = '1.0' encoding = 'UTF-8'?>
<voe:VOEvent
      ivorn="ivo://nasa.gsfc.gcn/SWIFT#XRT_Pos_1125809-104"
      role="observation" version="2.0"
      xmlns:voe="http://www.ivoa.net/xml/VOEvent/v2.0"
      xmlns:xsi="http://www.w3.org/2001/XMLSchema-instance"
      xsi:schemaLocation="http://www.ivoa.net/xml/VOEvent/v2.0  http://www.ivoa.net/xml/VOEvent/VOEvent-v2.0.xsd" >
  <Who>
    <AuthorIVORN>ivo://nasa.gsfc.tan/gcn</AuthorIVORN>
    <Author>
      <shortName>VO-GCN</shortName>
      <contactName>Scott Barthelmy</contactName>
      <contactPhone>+1-301-286-3106</contactPhone>
      <contactEmail>scott.barthelmy@nasa.gov</contactEmail>
    </Author>
    <Date>2022-09-30T11:15:09</Date>
    <Description>This VOEvent message was created with GCN VOE version: 15.08 17jun22</Description>
  </Who>
  <What>
    <Param name="Packet_Type"  value="67" />
    <Param name="Pkt_Ser_Num"  value="4" />
    <Param name="TrigID"       value="1125809" ucd="meta.id" />
    <Param name="Segment_Num"  value="0" ucd="meta.id.part" />
    <Param name="Burst_TJD"    value="19852" unit="days" ucd="time" />
    <Param name="Burst_SOD"    value="40482.14" unit="sec" ucd="time" />
    <Param name="Burst_Inten"  value="3.09e-09" unit="erg/cm2/sec" ucd="em.X-ray" />
    <Param name="Det_Signif"   value="9.53" unit="sigma" ucd="stat.snr" />
    <Param name="X_TAM_i1"     value="327.67" unit="pixel" />
    <Param name="Y_TAM_i1"     value="237.12" unit="pixel" />
    <Param name="X_TAM_i2"     value="261.62" unit="pixel" />
    <Param name="Y_TAM_i2"     value="243.71" unit="pixel" />
    <Param name="Amplifier"    value="0x2" />
    <Param name="Waveform"     value="0x86" />
    <Param name="Soln_Status"  value="0x0" />
    <Param name="Misc_flags"   value="0x0" />
    <Group name="Solution_Status" >
      <Param name="Cosmic_Ray"            value="false" />
      <Param name="Def_NOT_a_GRB"         value="false" />
      <Param name="Target_in_Gnd_Catalog" value="false" />
      <Param name="Spatial_Prox_Match"    value="false" />
      <Param name="Temporal_Prox_Match"   value="false" />
      <Param name="Test_Submission"       value="false" />
    </Group>
    <Group name="Misc_Flags" >
      <Param name="Values_Out_of_Range"   value="false" />
      <Param name="Target_in_Blk_Catalog" value="false" />
      <Param name="TOO_Generated"         value="false" />
      <Param name="Delayed_until_Image"   value="false" />
      <Param name="Updated_Notice"        value="false" />
      <Param name="Flt_Generated"         value="true" />
      <Param name="Gnd_Generated"         value="false" />
      <Param name="SERS_Generated"        value="false" />
      <Param name="CRC_Error"             value="false" />
    </Group>
    <Param name="Coords_Type"   value="1" unit="dn" />
    <Param name="Coords_String" value="source_object" />
    <Group name="Obs_Support_Info" >
      <Description>The Sun and Moon values are valid at the time the VOEvent XML message was created.</Description>
      <Param name="Sun_RA"        value="186.69" unit="deg" ucd="pos.eq.ra" />
      <Param name="Sun_Dec"       value="-2.89" unit="deg" ucd="pos.eq.dec" />
      <Param name="Sun_Distance"  value="121.43" unit="deg" ucd="pos.angDistance" />
      <Param name="Sun_Hr_Angle"  value="8.11" unit="hr" />
      <Param name="Moon_RA"       value="241.87" unit="deg" ucd="pos.eq.ra" />
      <Param name="Moon_Dec"      value="-22.73" unit="deg" ucd="pos.eq.dec" />
      <Param name="MOON_Distance" value="170.20" unit="deg" ucd="pos.angDistance" />
      <Param name="Moon_Illum"    value="22.84" unit="%" ucd="arith.ratio" />
      <Param name="Galactic_Long" value="180.86" unit="deg" ucd="pos.galactic.lon" />
      <Param name="Galactic_Lat"  value="-25.44" unit="deg" ucd="pos.galactic.lat" />
      <Param name="Ecliptic_Long" value="65.19" unit="deg" ucd="pos.ecliptic.lon" />
      <Param name="Ecliptic_Lat"  value="-7.94" unit="deg" ucd="pos.ecliptic.lat" />
    </Group>
    <Description>The Swift-XRT location in response to a Swift-BAT transient.</Description>
  </What>
  <WhereWhen>
    <ObsDataLocation>
      <ObservatoryLocation id="GEOLUN" />
      <ObservationLocation>
        <AstroCoordSystem id="UTC-FK5-GEO" />
        <AstroCoords coord_system_id="UTC-FK5-GEO">
          <Time unit="s">
            <TimeInstant>
              <ISOTime>2022-09-30T11:14:42.14</ISOTime>
            </TimeInstant>
          </Time>
          <Position2D unit="deg">
            <Name1>RA</Name1>
            <Name2>Dec</Name2>
            <Value2>
              <C1>64.7149</C1>
              <C2>13.3500</C2>
            </Value2>
            <Error2Radius>0.0013</Error2Radius>
          </Position2D>
        </AstroCoords>
      </ObservationLocation>
    </ObsDataLocation>
  <Description>The RA,Dec coordinates are of the type: source_object.</Description>
  </WhereWhen>
  <How>
    <Description>Swift Satellite, XRT Instrument</Description>
    <Reference uri="http://gcn.gsfc.nasa.gov/swift.html" type="url" />
  </How>
  <Why importance="0.99">
    <Inference probability="0.9">
      <Concept>process.variation.burst;em.gamma</Concept>
    </Inference>
  </Why>
  <Citations>
    <EventIVORN cite="followup">ivo://nasa.gsfc.gcn/SWIFT#BAT_GRB_Pos_1125809-092</EventIVORN>
    <Description>This is the XRT Position for the original BAT trigger.</Description>
  </Citations>
  <Description>
  </Description>
</voe:VOEvent>
